{
  "statement": {
    "speaker": "Sarah",
    "text": "Our secondary is absolutely killing us this year."
  },
  "question": "What is she talking about?",
  "options": [
    {
      "id": "a",
      "text": "The defensive backs",
      "isCorrect": true
    },
    {
      "id": "b",
      "text": "The kicker",
      "isCorrect": false
    },
    {
      "id": "c",
      "text": "Pass coverage",
      "isCorrect": true
    },
    {
      "id": "d",
      "text": "The stadium staff",
      "isCorrect": false
    }
  ],
  "translation": "The players defending against passes are playing badly, and the team is losing because of it.",
  "followUps": [
    {
      "line": "Is it the cornerbacks or the safeties?",
      "why": "Shows you know the secondary has two position groups."
    }
  ]
}
